Title	Text	Grade	Level
ပြည်ထောင်စု သမ္မတ မြန်မာ နိုင်ငံတော် အစိုးရ ပညာ ရေး ဝန်ကြီးဌာန ကျောင်း သုံး စာအုပ် စိတ် ကြိုက် မြန်မာ စာ ဧကာဒသမ တန်း မြန်မာ စကားပြေ ၂ဝ ၂ ၂ - ၂ဝ၂၃	ပြည်ထောင်စု သမ္မတ မြန်မာ နိုင်ငံတော် အစိုးရ ပညာ ရေး ဝန်ကြီးဌာန ကျောင်း သုံး စာအုပ် စိတ် ကြိုက် မြန်မာ စာ ဧကာဒသမ တန်း မြန်မာ စကားပြေ ၂ဝ ၂ ၂ - ၂ဝ၂၃	G11	Upper Secondary
ပြည်ထောင်စု သမ္မတ မြန်မာ နိုင်ငံတော် အစိုးရ ပညာ ရေး ဝန်ကြီးဌာန ကျောင်း သုံး စာအုပ် စိတ် ကြိုက် မြန်မာ စာ ဧကာဒသမ တန်း မြန်မာ စကားပြေ ၂ဝ ၂ ၂ - ၂ဝ ၂၄	ပြည်ထောင်စု သမ္မတ မြန်မာ နိုင်ငံတော် အစိုးရ ပညာ ရေး ဝန်ကြီးဌာန ကျောင်း သုံး စာအုပ် စိတ် ကြိုက် မြန်မာ စာ မြန်မာ စကားပြေ ဧကာဒသမ တန်း နိုင်ငံတော် က အခမဲ့ ထောက်ပံ့ ပေး သည် ။ အခြေခံ ပညာ သင်ရိုးညွှန်းတမ်း နှင့် ကျောင်း သုံး စာအုပ် ကော်မတီ ၂၀၂၂ - ၂၀၂၃	G11	Upper Secondary
ပြည်ထောင်စု သမ္မတ မြန်မာ နိုင်ငံတော် အစိုးရ ပညာ ရေး ဝန်ကြီးဌာန ကျောင်း သုံး စာအုပ် စိတ် ကြိုက် မြန်မာ စာ ဧကာဒသမ တန်း မြန်မာ စကားပြေ ၂ဝ ၂ ၂ - ၂ဝ ၂၅	၂ဝ ၂ ၂ ခု နှစ် ၊ မတ် လ ၊ အုပ် ရေ - ၁၂၇၆ ၃၀ အုပ် ၂ဝ ၂ ၂ - ၂၀၂၃ ပညာသင် နှစ် အမျိုးသား သင်ရိုးညွှန်းတမ်း ကော်မတီ က အတည်ပြု သည် ။ အခြေခံ ပညာ သင်ရိုးညွှန်းတမ်း နှင့် ကျောင်း သုံး စာအုပ် ကော်မတီ ၏ မူ ပိုင် ဖြစ် သည် ။ အလုပ် အမိန့် အမှတ် – K - ၁၀ ၁ / ၂ ၂ ဖြင့် တော် ဝင် မြင့်မိုရ် ကုမ္ပဏီ ရန်ကုန် မြို့ က ပုံနှိပ် သည် ။	G11	Upper Secondary
ဧကာဒသမ တန်း စိတ် ကြိုက် မြန်မာ စာ	မြန်မာ စကားပြေ ကျောင်း သုံး စာအုပ် မိတ်ဆက်	G11	Upper Secondary
မြန်မာ စကားပြေ ကျောင်း သုံး စာအုပ် မိတ်ဆက်	စိတ် ကြိုက် မြန်မာ စာ ဘာသာရပ် ကို သင်ယူ နေ ကြ သော ကျောင်းသား တို့ သည် ဒသမ တန်း တွင် စိတ် ကြိုက် မြန်မာ စာ ဘာသာရပ် ၏ မြန်မာ စကားပြေ သင်ခန်းစာ များ ကို သင်ယူ ခဲ့ ပြီး ဖြစ် ပါ သည် ။ ဧကာဒသမ တန်း တွင် သုတ ရ သ မြန်မာ စကားပြေ သင်ခန်းစာ တို့ ကို ဆက်လက် လေ့လာ ရ မည် ဖြစ် သည် ။ ဧကာဒသမ တန်း မြန်မာ စကားပြေ သင်ခန်းစာ တို့ တွင် ဗဟုသုတ ကို အား ပြု သော စကားပြေ များ အပြင် ဘဝ အသိအမြင် ကို ဖော်ဆောင် သော ရ သ စကားပြေ ကဏ္ဍ ကို လည်း ဆက်လက် လေ့လာ နိုင် မည် ဖြစ် သည် ။	G11	Upper Secondary
မြန်မာ စကားပြေ ကျောင်း သုံး စာအုပ် မိတ်ဆက်	ဧကာဒသမ တန်း စိတ် ကြိုက် မြန်မာ စာ မြန်မာ စကားပြေ ကျောင်း သုံး စာအုပ် တွင် ပုဂံ ခေတ် လယ် ကာလ က ပေါ်ထွန်း ခဲ့ သော ရှေး မြန်မာ မင်စာ စကားပြေ အရေးအသား မှ စတင် ပြီး မျက်မှောက် ကာလ တိုင် ခေတ် အဆက်ဆက် ပြောင်းလဲ ဖွံ့ဖြိုး တိုးတက် လာ သော စကားပြေ တို့ ကို လေ့လာ ရ မည် ဖြစ် သည် ။ မြန်မာ စကားပြေ များ က ပေး သော အကြောင်းအရာ များ ကို စုပေါင်း လေ့လာ သင်ယူ ခြင်း ဖြင့် သုတ စကားပြေ များ မှ တစ် ဆင့် မိမိ တို့ ဒေသ ရပ် ရွာ ရှိ အကြောင်းအရာ တို့ ကို အချင်းချင်း ပြော ဆို ဆွေးနွေး ဗဟုသုတ ဖလှယ် နိုင် မည် ဖြစ် သည် ။ ရ သ စကားပြေ များ ကို လေ့လာ ခြင်း ဖြင့် အာနိသင် ရ သ မှ တစ် ဆင့် တွေးတော ဆင်ခြင် သုံးသပ် တတ် သော အလေ့အကျင့် များ ဖွံ့ဖြိုး တိုးတက် လာ မည် ဖြစ် သည် ။ သင်ယူ လေ့လာ ရာ တွင် မြန်မာ စကားပြေ တို့ ကို ကျောင်းသား တစ် ဦး ချင်း က အသံ ထွက် ဖတ် စေ ခြင်း ၊ အုပ်စု လိုက် သံပြိုင် ဖတ် စေ ခြင်း ၊ အပြန်အလှန် စကား ပြော ဟန် ဖြင့် ဖတ်ရှု စေ ခြင်း တို့ ဖြင့် အရွတ် အဖတ် အပြောအဆို စွမ်းရည် မြင့်မား လာ စေ မည် ဖြစ် သည် ။	G11	Upper Secondary
မြန်မာ စကားပြေ ကျောင်း သုံး စာအုပ် မိတ်ဆက်	အကြောင်းအရာ တို့ ကို ဝေဖန် ပြော ဆို ခြင်း ဖြင့် ဆွေးနွေး သုံးသပ် ဆင်ခြင် နိုင် သည့် စွမ်းရည် ကို ရ ရှိ မည် ။ ရှေးခေတ် စကား အသုံးအနှုန်း များ လုပ်ငန်းခွင် သုံး စကား အသုံးအနှုန်း များ ၊ ပညာရပ် ဝေါဟာရ များ ၊ ဒေသ သုံး စကား များ ကို လေ့လာ ခြင်း ဖြင့် ဝေါဟာရ ဗဟုသုတ တိုးပွား လာ မည် ဖြစ် သည် ။ ပြေပြစ် ချောမွေ့ သော ဝါကျ အဖွဲ့ များ ကို အတုယူ လေ့လာ နိုင် မည် ဖြစ် သည် ။	G11	Upper Secondary
သင်ယူ ကြ ရ မည့် အကြောင်းအရာ	ဧကာဒသမ တန်း စိတ် ကြိုက် မြန်မာ စာ မြန်မာ စကားပြေ ကျောင်း သုံး စာအုပ် တွင် အောက် ပါ အကြောင်းအရာ တို့ ကို သင်ယူ ရ မည် ဖြစ် သည် ။ အခန်း ၁ ။ ရှေး စကားပြေ မိတ်ဆက် နှင့် စကားပြေ ရွေးချယ် ချက် အခန်း ၂ ။ ခေတ် စကားပြေ မိတ်ဆက် နှင့် စကားပြေ ရွေးချယ် ချက် အခန်း ၃ ။ ရ သ စာတမ်း စကားပြေ မိတ်ဆက် နှင့် စကားပြေ ရွေးချယ် ချက်	G11	Upper Secondary
သင်ယူ ကြ ရ မည့် နည်းလမ်း များ	စိတ် ကြိုက် မြန်မာ စာ စကားပြေ သင်ခန်းစာ တို့ တွင် စိတ် ပါ ဝင် စား စွာ သင်ကြား သင်ယူ နိုင် ရန် သုတ ရ သ စကားပြေ တို့ ၏ တန်ဖိုး ကို လေ့လာ သင်ကြား ပေး ရ မည် ဖြစ် ပါ သည် ။ သုတ စကားပြေ တို့ ကို လေ့လာ လျှင် မည် သည့် ဗဟုသုတ ကို ရ ရှိ စေ ရန် ရည်ရွယ် ရေး ဖွဲ့ သည် ဆို သော အချက် ကို ဦး စွာ ဆွေးနွေး ရ မည် ဖြစ် သည် ။ ရ သ စကားပြေ ကို ဖတ်ရှု ပြီး လျှင် မည် သည့် ခံစား မှု မျိုး ဖြစ် ပေါ် လာ သနည်း ဟူသော အချက် ကို လက်တွေ့ ကျ ကျ မေးမြန်း ဆွေးနွေး ရ မည် ဖြစ် သည် ။	G11	Upper Secondary
သင်ယူ ကြ ရ မည့် နည်းလမ်း များ	ထို့နောက် တစ် ဆင့် တက် ၍ စကားပြေ ရေး ဖွဲ့ သူ က ဗဟုသုတ ရ အောင် မည် သို့ ရေး ဖွဲ့ ထား သနည်း ဟူသော အရေး အဖွဲ့ ပိုင်း ဆိုင်ရာ စကားလုံး အသုံးအနှုန်း နှင့် ဝါကျ ကဏ္ဍ တို့ ကို လေ့လာ ဆွေးနွေး ရ ပါ မည် ။ ရ သ စာတမ်း တို့ ကို ဖတ်ရှု ပြီး နောက် တွင် ကျောင်း သူ ကျောင်းသား တို့ ၏ ကိုယ်ပိုင် ခံစား မှု ကို အချင်းချင်း ဆွေးနွေး မေးမြန်း သော နည်း ၊ ခံစား မှု ဖလှယ် သော နည်း တို့ ကို သုံး ၍ လေ့လာ သင်ကြား သင့် သည် ။ ထို သို့ သုတ ၊ ရ သ တို့ ကို ဖော်ဆောင် နိုင် အောင် စာ ရေး သူ က မည် သည့် အရေး အဖွဲ့ နည်း နာ ကို အသုံးပြု သွား သနည်း ဟူသော ခွဲခြမ်း စိတ်ဖြာ ဆန်းစစ် လေ့လာ သော နည်း ဖြင့် အရေးအသား ကို လေ့လာ သင်ယူ မည် ဖြစ် သည် ။	G11	Upper Secondary
လေ့လာ မှု နယ်ပယ် ငါး ရပ်	( က ) ရည်ရွယ် ချက် သို့ မ ဟုတ် အာဘော်	G11	Upper Secondary
( က ) ရည်ရွယ် ချက် သို့ မ ဟုတ် အာဘော်	မြန်မာ စကားပြေ သင်ခန်းစာ တို့ ၏ ရည်ရွယ် ချက် သို့ မ ဟုတ် အာဘော် ကို လေ့လာ ခြင်း သည် စကားပြေ တစ် ပုဒ် ချင်း တွင် တွေ့ ရ သော စာ ရေး သူ ၏ စိတ် စေတနာ နှင့် အသိပေး ဖော်ပြ လို သော အကြောင်းအရာ ကို လေ့လာ ခြင်း ပင် ဖြစ် သည် ။ အသိပညာ ပေး လို သော ရည်ရွယ် ချက် ဖြင့် ရေး သား ထား သော စကားပြေ သည် သုတ စကားပြေ ဖြစ် ပြီး စာ ရေး သူ က မိမိ ပေး လို သော အသိပညာ သတင်း အချက်အလက် သို့ ရောက် အောင် ဦးတည် ရေး ဖွဲ့ လေ့ ရှိ သည် ။ ဤ ဖတ် စာ တွင် ပါ ဝင် သော ဆည်မြောင်း ပညာ နှင့် ရှေးခေတ် မြန်မာ စကားပြေ သည် သုတ စကားပြေ ဖြစ် ပြီး စာ ရေး သူ က ရှေး မြန်မာ တို့ ၏ ဆည်မြောင်း အတတ်ပညာ ကို နိုင်ငံခြား မှ အင်ဂျင်နီယာ ပညာရှင် များ ကိုယ်တိုင် အံ့ဩ ချီးကျူး ပုံ ကို သိ စေ လို သော ရည်ရွယ် ချက် ဖြင့် တင်ပြ ထား သည် ။ မိုးညို နှင့် ဂျီ ဗိုလ် ဆောင်းပါး သည် သုတ ရ သ နှစ် ထွေ ရော သော ဆောင်းပါး မျိုး ဖြစ် သည် ။ ကျွဲခတ် ပွဲ ကျင်းပ ပုံ ကို သုတ ပေး လို သော ဆန္ဒ ၊ ကျေးလက် ပြည်သူ တို့ ၏ ဘဝ နှင့် အနုပညာ အဆက်အစပ် ကို နားလည် ခံစား စေ လို သော စေတနာ က ရ သ ခံစား မှု ကို ဖြစ် ပေါ် စေ သည် ။ ယင်း သည် ပင် စာ ရေး သူ ၏ ရည်ရွယ် ချက် ဖြစ် သည် ။	G11	Upper Secondary
( က ) ရည်ရွယ် ချက် သို့ မ ဟုတ် အာဘော်	သန္နိဋ္ဌာန် ၏ စွမ်းအား ရ သ စာတမ်း သည် ဘဝ ကို အရှုံး မ ပေး သော လူငယ် တစ် ယောက် ၏ စိတ်ဓာတ် နှင့် ဇွဲ သတ္တိ က ခွန်အား ကို ဖြစ် စေ နိုင် သည် ဟူသော ရည်ရွယ် ချက် က ဦးဆောင် နေ သည် ။	G11	Upper Secondary
( ခ ) အကြောင်းအရာ အစီအစဉ်	စကားပြေ ကောင်း တစ် ပုဒ် ကို လေ့လာ ရာ တွင် ပါ ဝင် သော အကြောင်းအရာ နှင့် လိုက် ဖက် သော အရေးအသား သည် လက်ဖဝါး နှင့် လက်ဖမိုး ကဲ့သို့ တစ် သား တည်း ဖြစ် နေ ရန် လိုအပ် သည် ။ သို့ မှ သာ ပြော လို သော အကြောင်းအရာ ကို အရေးအသား က တစ်ပြေးညီ လိုက်လံ ပံ့ပိုး ပေး နေ တတ် သည် ကို သတိပြု နည်း နာ ယူ ရန် ဖြစ် ပါ သည် ။	G11	Upper Secondary
( ခ ) အကြောင်းအရာ အစီအစဉ်	ချီးမွမ်း ခြင်း စကားပြေ ကို လေ့လာ ပါ က အသိဉာဏ် နည်း သော လူ မိုက် တို့ ၏ သဘော သည် မည် သို့ ဖြစ် ကြောင်း စာ ရေး သူ က ပုံ ဆောင် ကာ ရှင်းပြ နေ သည် ကို ဆင်ခြင် စဉ်းစား ကြည့် ခြင်း ဖြင့် ဖွင့် ဆို ရှင်းပြ ရေး နည်း ၏ သဘောသဘာဝ ကို ထင်ထင်ရှားရှား လေ့လာ နိုင် သည် ။	G11	Upper Secondary
( ခ ) အကြောင်းအရာ အစီအစဉ်	စကားပြေ ပါ အကြောင်းအရာ အချက်အလက် က မည် မျှ ခိုင်လုံ သည် ကို အကျိုးအကြောင်း ပြ အရေးအသား က ပံ့ပိုး သည် ။ မိတ်ဆွေ စစ် စကားပြေ တွင် မိတ်ဆွေ စစ် ဟု ခေါ် ရ ခြင်း သည် အဘယ် ကြောင့် ဟူသော သဘော ကို စာ ရေး သူ က အကျိုးအကြောင်း ခိုင်ခိုင်လုံလုံ တင်ပြ ထား ကြောင်း သတိပြု လေ့လာ ရာ သည် ။	G11	Upper Secondary
( ခ ) အကြောင်းအရာ အစီအစဉ်	ပင်လယ်ကူးသင်္ဘော ကြီး နစ်မြုပ် သည့် ဖြစ် စဉ် ကို စာ ရေး သူ က အချိန် နာရီ နှင့်တကွ သရုပ်ဖော် ကာ မှတ်တမ်းတင် ရေး သား နေ သည့် အတွက် သရုပ်ဖော် နှင့် ဖြစ် စဉ် ပြ အရေး အဖွဲ့ သဘော အ လေး ကဲ နေ သည် ကို အတုယူ လေ့လာ စေ ခြင်း ဖြင့် မှတ်တမ်း သဘော နှင့် ရ သ ခံစား မှု ဒွန်တွဲ နေ ပုံ ကို သင်ကြား ရန် ဖြစ် သည် ။	G11	Upper Secondary
လေ့လာ မှု နည်းလမ်း ငါး ရပ်	* ပူးပေါင်း ဆောင်ရွက် ခြင်း - စကားပြေ ဖတ် စာ ပါ အကြောင်းအရာ တို့ ကို စိတ်ဝင်တစား ဖတ်ရှု စေ ခြင်း သည် လေ့လာ သင်ကြား ရေး တွင် အခြေခံ ဖြစ် သည် ။ အတန်း ထဲ တွင် ရ သ စာတမ်း များ ကို တစ် ယောက် ချင်း ဖတ်ရှု စေ ခြင်း ၊ အုပ်စု ဖွဲ့ ကာ အပြန်အလှန် ဖတ် စေ ခြင်း ဖြင့် အသံ ထွက် စာဖတ် သည့် အလေ့ ကို ပျိုးထောင် ပေး ရန် လိုအပ် သည် ။ တစ် ဖွဲ့ က ဖတ် သည် ကို တစ် ဖွဲ့ က နားစိုက်ထောင် စေ ခြင်း ၊ အသံ အဖြတ်အရပ် ၊ စကား သံ ပီသ ကြည် မြ မှု ၊ အများ စိတ်ဝင်စား အောင် အသံ နေ အသံ ထား ဖြင့် သရုပ်ဆောင် ဖတ်ရှု နိုင် မှု တို့ ဖြင့် ပူးပေါင်း ဆောင်ရွက် မှု စွမ်းရည် ကို မြင့် တင် စေ နိုင် သည် ။	G11	Upper Secondary
လေ့လာ မှု နည်းလမ်း ငါး ရပ်	* ဆက်သွယ် ပြော ဆို ခြင်း - စကားပြေ တွင် ပါ ဝင် သော စကား ပြော ဟန် တို့ ကို အတုယူ လေ့လာ စေ ခြင်း ၊ အပြန်အလှန် ပြော ဆို ဟန် ပြု ခြင်း ၊ စာ သား ကို အထစ်အငေါ့ မ ရှိ ဘဲ ပြော စေ ခြင်း ဖြင့် စကားပြေ အရေးအသား ချောမွေ့ ပြေပြစ် မှု ရှိ မ ရှိ ကို လက်တွေ့ ဆန်းစစ် နိုင် မည် ။ ထို သို့ ပြု မူ ခြင်း ဖြင့် တစ် ဦး နှင့် တစ် ဦး ပြော ဆို ဆက်သွယ် မှု စွမ်းရည် တိုးတက် လာ စေ မည် ဖြစ် သည် ။	G11	Upper Secondary
လေ့လာ မှု နည်းလမ်း ငါး ရပ်	* လေးနက် စွာ ဆန်းစစ် ဝေဖန် ခြင်း နှင့် ပြဿနာ ဖြေရှင်း ခြင်း - စကားပြေ လာ အကြောင်းအရာ များ ကို ဆန်းစစ် ဝေဖန် တတ် မှ သာ စကားပြေ ကို သင်ယူ ရ ကျိုးနပ် ပေ လိမ့် မည် ။ မိမိ လေ့လာ နေ သော စကားပြေ တစ် ပုဒ် သည် မည် သည့် အချက်အလက် ကို ညွှန်ပြ နေ သနည်း ၊ လက်တွေ့ ဘဝ နှင့် မည် သို့ ဆက်စပ် နေ သနည်း ၊ ဘဝ ပြဿနာ တို့ ကို ဖြေရှင်း ရာ တွင် စကားပြေ သင်ခန်းစာ တို့ က မည် သို့ အထောက်အကူပြု သနည်း စ သည် ဖြင့် ဆက်စပ် စဉ်းစား နိုင် အောင် သင် ပြ ရန် လိုအပ် သည် ။ သို့ မှ သာ စာ တွေ့ သည် လက်တွေ့ ဘဝ ကို အကျိုးပြု နိုင် မည် ဖြစ် သည် ။	G11	Upper Secondary
လေ့လာ မှု နည်းလမ်း ငါး ရပ်	* တီထွင် ဖန်တီး ခြင်း - စကားပြေ အရေးအသား ကို မှန်ကန် စွာ ရေး သား နိုင် ရန် လေ့ကျင့် မှု သည် အခြေခံ အချက် ဖြစ် သည် ။ အရေးအသား မှန်ကန် စေ ရန် စကားပြေ ကောင်း တို့ ကို ဖတ်ရှု ရန် လေ့ကျင့် ရ မည် ။ အဖတ် အ ရှု များ လျှင် စကား အသုံးအနှုန်း ၊ ဝါကျ အချော အမွေ ကို နားလည် လာ ပြီး ကိုယ်တိုင် ရေး သား ရာ တွင် အထောက်အကူပြု မည် ဖြစ် သည် ။ အကြောင်းအရာ အရေးအသား အခြေခံ ခိုင် လျှင် တီထွင် ဖန်တီး နိုင် ရန် အတွက် အခက်အခဲ မ ရှိ နိုင် ကြောင်း နားလည် လာ မည် ။ ထိုအခါ မေးခွန်း များ တွင် ပါ သော ကိုယ်တိုင် ရေး သား စေ သည့် လေ့ကျင့်ခန်း ကို ကောင်း စွာ ဆောင်ရွက် နိုင် မည် ။	G11	Upper Secondary
လေ့လာ မှု နည်းလမ်း ငါး ရပ်	* နိုင်ငံ သား ကောင်း ဖြစ် ခြင်း - သုတ စကားပြေ တို့ ကို လေ့လာ ခြင်း ဖြင့် ကျောင်းသား တစ် ဦး သည် သူ ၏ အသက်အရွယ် အလိုက် သိ ရှိ ရ မည့် အခြေခံ ဗဟုသုတ များ ကို ရ ရှိ မည် ။ ထို့အတူ ရ သ စကားပြေ များ ကို ဖတ်ရှု ရ ခြင်း ဖြင့် ဘဝ တွင် ကြုံတွေ့ လာ ရ မည့် ပြဿနာ ၊ စိမ် ခေါ် မှု ၊ ရုန်းကန် လှုပ်ရှား ရ မှု တို့ ကို နားလည် သဘောပေါက် မည် ။ အရေးအကြီးဆုံး မှာ ကိုယ်ချင်းစာ ခံစား တတ် ခြင်း ၊ နားလည် မှု ၊ ခွင့်လွှတ် တတ် မှု ၊ သည်းခံ မှု တို့ ကို နှလုံးသွင်း တတ် လာ ခြင်း ဖြစ် သည် ။ ထို မှ တစ် ဆင့် စိတ် ကောင်း နှလုံး ကောင်း မွေးမြူ တတ် သော နိုင်ငံ သား ကောင်း တစ် ဦး တွင် ရှိ အပ် သော အလေ့အကျင့် ကောင်း များ ရ ရှိ လာ မည် ။	G11	Upper Secondary
